{
  "name": "dashboard",
  "version": "2.0.0",
  "description": "Responsive dashboard starter",
  "supportedArchitectures": [
    "atomic",
    "feature",
    "hybrid"
  ],
  "dependencies": [],
  "npmDependencies": {},
  "npmDevDependencies": {},
  "environmentVariables": [],
  "files": {
    "atomic": [
      {
        "source": "templates/page.tsx",
        "target": "src/app/dashboard/page.tsx"
      }
    ],
    "feature": [
      {
        "source": "templates/page.tsx",
        "target": "src/app/dashboard/page.tsx"
      }
    ],
    "hybrid": [
      {
        "source": "templates/page.tsx",
        "target": "src/app/dashboard/page.tsx"
      }
    ]
  },
  "instructions": []
}
