{"name":"confirmation-dialog","version":"1.0.0","description":"Accessible reusable destructive action confirmation","supportedArchitectures":["atomic","feature","hybrid"],"dependencies":[],"npmDependencies":{"@radix-ui/react-alert-dialog":"^1.1.15"},"npmDevDependencies":{},"environmentVariables":[],"files":{"atomic":[{"source":"templates/confirmation-dialog.tsx","target":"{{aliases.components}}/molecules/confirmation-dialog.tsx"}],"feature":[{"source":"templates/confirmation-dialog.tsx","target":"{{aliases.components}}/confirmation-dialog.tsx"}],"hybrid":[{"source":"templates/confirmation-dialog.tsx","target":"{{aliases.components}}/molecules/confirmation-dialog.tsx"}]},"instructions":[]}
