{"name":"security-headers","version":"1.0.0","description":"Next.js-compatible configurable security headers","supportedArchitectures":["atomic","feature","hybrid"],"dependencies":[],"npmDependencies":{},"npmDevDependencies":{},"environmentVariables":[],"files":{"atomic":[{"source":"templates/security.ts","target":"src/config/security.ts"}],"feature":[{"source":"templates/security.ts","target":"src/config/security.ts"}],"hybrid":[{"source":"templates/security.ts","target":"src/config/security.ts"}]},"instructions":["Apply exported headers from next.config.ts and tune CSP for every added third-party origin."]}
