{"name":"ssrf-protection","version":"1.0.0","description":"DNS-aware bounded outbound HTTPS requests","supportedArchitectures":["atomic","feature","hybrid"],"dependencies":[],"npmDependencies":{},"npmDevDependencies":{},"environmentVariables":[],"files":{"atomic":[{"source":"templates/safe-fetch.ts","target":"{{aliases.lib}}/safe-fetch.ts"}],"feature":[{"source":"templates/safe-fetch.ts","target":"{{aliases.lib}}/safe-fetch.ts"}],"hybrid":[{"source":"templates/safe-fetch.ts","target":"{{aliases.lib}}/safe-fetch.ts"}]},"instructions":["Serverless platforms can apply additional network routing; use an egress proxy for high-assurance SSRF isolation."]}
