{
  "name": "input-validation",
  "version": "1.0.0",
  "description": "Shared Zod validation and safe JSON parsing",
  "supportedArchitectures": ["atomic", "feature", "hybrid"],
  "dependencies": [],
  "npmDependencies": {},
  "npmDevDependencies": {},
  "environmentVariables": [],
  "files": {
    "atomic": [{ "source": "templates/validation.ts", "target": "{{aliases.lib}}/validation.ts" }],
    "feature": [{ "source": "templates/validation.ts", "target": "{{aliases.lib}}/validation.ts" }],
    "hybrid": [{ "source": "templates/validation.ts", "target": "{{aliases.lib}}/validation.ts" }]
  },
  "instructions": []
}
