{
  "name": "search-filter",
  "version": "1.0.0",
  "description": "Debounced URL search input for list filtering",
  "supportedArchitectures": ["atomic", "feature", "hybrid"],
  "dependencies": [],
  "npmDependencies": {},
  "npmDevDependencies": {},
  "environmentVariables": [],
  "files": {
    "atomic": [{ "source": "templates/search-filter.tsx", "target": "{{aliases.components}}/molecules/search-filter.tsx" }],
    "feature": [{ "source": "templates/search-filter.tsx", "target": "{{aliases.components}}/search-filter.tsx" }],
    "hybrid": [{ "source": "templates/search-filter.tsx", "target": "{{aliases.components}}/molecules/search-filter.tsx" }]
  },
  "instructions": ["Search terms are user input: never inject them into queries directly, use parameterized/SDK queries and apply length limits."]
}
