{"name":"crud-example","version":"1.0.0","description":"Secure Product CRUD reference with search and pagination","supportedArchitectures":["atomic","feature","hybrid"],"dependencies":["input-validation","api-response","confirmation-dialog"],"npmDependencies":{},"npmDevDependencies":{},"environmentVariables":[],"files":{"atomic":[{"source":"templates/schema.ts","target":"src/features/products/schema.ts"},{"source":"templates/route.ts","target":"src/app/api/products/route.ts"},{"source":"templates/page.tsx","target":"src/app/products/page.tsx"}],"feature":[{"source":"templates/schema.ts","target":"src/features/products/schema.ts"},{"source":"templates/route.ts","target":"src/app/api/products/route.ts"},{"source":"templates/page.tsx","target":"src/app/products/page.tsx"}],"hybrid":[{"source":"templates/schema.ts","target":"src/features/products/schema.ts"},{"source":"templates/route.ts","target":"src/app/api/products/route.ts"},{"source":"templates/page.tsx","target":"src/app/products/page.tsx"}]},"instructions":["The in-memory repository demonstrates boundaries only. Select a backend provider and replace it with parameterized/SDK queries plus ownership policies for production."]}
