{"name":"api-response","version":"1.0.0","description":"Typed API response helpers","supportedArchitectures":["atomic","feature","hybrid"],"dependencies":[],"npmDependencies":{},"npmDevDependencies":{},"environmentVariables":[],"files":{"atomic":[{"source":"templates/api-response.ts","target":"{{aliases.lib}}/api-response.ts"}],"feature":[{"source":"templates/api-response.ts","target":"{{aliases.lib}}/api-response.ts"}],"hybrid":[{"source":"templates/api-response.ts","target":"{{aliases.lib}}/api-response.ts"}]},"instructions":[]}
