{
  "name": "confirmation-dialog",
  "version": "1.0.0",
  "description": "Accessible reusable destructive action confirmation",
  "supportedArchitectures": ["atomic", "feature", "hybrid"],
  "dependencies": [],
  "npmDependencies": {},
  "npmDevDependencies": {},
  "environmentVariables": [],
  "files": {
    "atomic": [
      {
        "source": "templates/confirmation-dialog.tsx",
        "target": "{{dir.sharedComponents}}/confirmation-dialog.tsx"
      }
    ],
    "feature": [
      {
        "source": "templates/confirmation-dialog.tsx",
        "target": "{{dir.sharedComponents}}/confirmation-dialog.tsx"
      }
    ],
    "hybrid": [
      {
        "source": "templates/confirmation-dialog.tsx",
        "target": "{{dir.sharedComponents}}/confirmation-dialog.tsx"
      }
    ]
  },
  "instructions": []
}
