{
  "name": "protected-routes",
  "version": "2.0.0",
  "description": "Next.js 16 proxy that refreshes sessions and redirects anonymous visitors away from app pages",
  "supportedArchitectures": ["atomic", "feature", "hybrid"],
  "supportedBackends": ["supabase", "firebase"],
  "dependencies": ["api-response", "error-handling"],
  "npmDependencies": {},
  "npmDevDependencies": {},
  "environmentVariables": [],
  "files": {
    "atomic": [
      {
        "source": "templates/proxy.supabase.ts",
        "target": "proxy.ts",
        "when": {
          "backend": ["supabase"]
        }
      },
      {
        "source": "templates/proxy.firebase.ts",
        "target": "proxy.ts",
        "when": {
          "backend": ["firebase"]
        }
      },
      {
        "source": "templates/protected-route.ts",
        "target": "src/app/api/me/route.ts"
      }
    ],
    "feature": [
      {
        "source": "templates/proxy.supabase.ts",
        "target": "proxy.ts",
        "when": {
          "backend": ["supabase"]
        }
      },
      {
        "source": "templates/proxy.firebase.ts",
        "target": "proxy.ts",
        "when": {
          "backend": ["firebase"]
        }
      },
      {
        "source": "templates/protected-route.ts",
        "target": "src/app/api/me/route.ts"
      }
    ],
    "hybrid": [
      {
        "source": "templates/proxy.supabase.ts",
        "target": "proxy.ts",
        "when": {
          "backend": ["supabase"]
        }
      },
      {
        "source": "templates/proxy.firebase.ts",
        "target": "proxy.ts",
        "when": {
          "backend": ["firebase"]
        }
      },
      {
        "source": "templates/protected-route.ts",
        "target": "src/app/api/me/route.ts"
      }
    ]
  },
  "instructions": [
    "proxy.ts replaces the deprecated middleware.ts convention in Next.js 16. If you still have middleware.ts, delete it.",
    "Edit isProtected() to list the page prefixes that require a session.",
    "Proxy is a UX layer only. Keep calling requireUser() in every Route Handler and Server Component."
  ]
}
